{
  "suite_id": "quote.step1.fields",
  "title": "报价第 1 步：字段来源、推荐标识与人工修改",
  "domain": "quote",
  "notes": "每个字段都要能回答「谁写的」：ai_recommended / manual / system；缺字段不得被当成已完成。",
  "cases": [
{"id":"quote.step1.fields.system_source","version":"1.0","title":"系统计算项标记为 system 来源","domain":"quote","priority":"P1","layer":"deterministic","quote_step":1,"failure_type":"none","roles":["sales_mgr"],"preconditions":{"card":"qs_f1"},"input":{"idempotency_key":"fields-q1-sys","session_id":"qs_f1"},"actions":[{"op":"create_quote_card","session_id":"qs_f1","actor":"erin","owner":"erin","fields":{"customer":"瑞浦兰钧","quote_no":{"value":"Q-2026-001","source":"system"}}},{"op":"ui_board_sync","session_id":"qs_f1"}],"expected":{"http":{"code":"board_synced"},"state":{"quote.qs_f1.fields.quote_no.source":"system","quote.qs_f1.fields.customer.source":"system"},"ui_protocol":{"field_source_badge":{"$contains":"system"}},"forbidden":["legacy_wording"]},"invariants":["left_right_consistent"],"tags":["normal"],"source_specs":["docs/specs/quote-tech-unified-composer-and-binding-caption.md"]},
{"id":"quote.step1.fields.ai_then_manual","version":"1.0","title":"AI 推荐被人工修改后，徽标从 ai_recommended 切成 manual","domain":"quote","priority":"P1","layer":"deterministic","quote_step":1,"failure_type":"none","roles":["sales_mgr"],"preconditions":{"card":"qs_f2 已解析"},"input":{"idempotency_key":"fields-q1-manual","session_id":"qs_f2"},"actions":[{"op":"create_quote_card","session_id":"qs_f2","actor":"erin","owner":"erin"},{"op":"quote_parse_requirement","session_id":"qs_f2","actor":"erin","document":"documents/requirement_ev_full.json","idempotency_key":"fields-q1-parse"},{"op":"quote_edit_field","session_id":"qs_f2","actor":"erin","field":"capacity","value":"8.0GWh","source":"manual"},{"op":"ui_board_sync","session_id":"qs_f2"}],"expected":{"http":{"code":"board_synced"},"state":{"quote.qs_f2.fields.capacity.value":"8.0GWh","quote.qs_f2.fields.capacity.source":"manual"},"ui_protocol":{"field_source_badge":{"$contains":"manual"},"board_left_right_sync":true},"forbidden":["legacy_wording"]},"invariants":["left_right_consistent"],"tags":["normal","manual-override"],"source_specs":["docs/specs/quote-tech-unified-composer-and-binding-caption.md"]},
{"id":"quote.step1.fields.missing_blocks_complete","version":"1.0","title":"没有任何需求字段时不能把第 1 步标记完成（409）","domain":"quote","priority":"P0","layer":"deterministic","quote_step":1,"failure_type":"missing_prerequisite","roles":["sales_mgr"],"preconditions":{"card":"qs_f3 空卡片"},"input":{"idempotency_key":"fields-q1-empty","session_id":"qs_f3"},"actions":[{"op":"create_quote_card","session_id":"qs_f3","actor":"erin","owner":"erin"},{"op":"quote_complete_step","session_id":"qs_f3","step":1,"actor":"erin","snapshot":{"base_cost":"5.6000"},"idempotency_key":"fields-q1-empty","expect":{"status":409,"code":"required_fields_missing"}}],"expected":{"http":{"status":409,"code":"required_fields_missing"},"state":{"quote.qs_f3.current_step":1,"quote.qs_f3.steps.1":{"$absent":true}},"records":{"quote_steps_completed":0},"forbidden":["completed_without_confirm","unsaved_on_failure"]},"invariants":["step_monotonic"],"tags":["negative","prerequisite"],"source_specs":["cpq_wf.py","docs/specs/quote-tech-unified-composer-and-binding-caption.md"]},
{"id":"quote.step1.fields.edit_role_denied","version":"1.0","title":"技术工艺角色不能改报价字段（403）","domain":"quote","priority":"P0","layer":"deterministic","quote_step":1,"failure_type":"permission_denied","roles":["process_mgr","sales_mgr"],"preconditions":{"card":"qs_f4 归属 erin"},"input":{"idempotency_key":"fields-q1-deny","session_id":"qs_f4"},"actions":[{"op":"create_quote_card","session_id":"qs_f4","actor":"erin","owner":"erin","fields":{"customer":"亿纬锂能"}},{"op":"quote_edit_field","session_id":"qs_f4","actor":"carol","field":"customer","value":"被工艺经理改坏了","source":"manual","expect":{"status":403,"code":"step_role_forbidden"}}],"expected":{"http":{"status":403,"code":"step_role_forbidden"},"state":{"quote.qs_f4.fields.customer.value":"亿纬锂能"},"forbidden":["denied_actor_allowed","unsaved_on_failure"]},"invariants":["single_source_of_truth"],"tags":["negative","deny","permission"],"source_specs":["cpq_wf.py"]}
  ]
}
