{
  "suite_id": "cross_agent.handoff_legacy",
  "title": "历史报价卡片兼容：晚到技术回传只合并快照，不倒退当前步骤，重复提交幂等",
  "domain": "cross_agent",
  "notes": "对应 legacy_quote_case fixture：报价已到第 4 步，技术回传必须兼容且不串项目。",
  "cases": [
    {"id": "cross.legacy.late_handoff_no_step_rollback", "version": "1.0", "title": "历史报价已到第 4 步：晚到的技术成本回传只合并快照，不让报价退回第 2/3 步", "domain": "cross_agent", "priority": "P0", "layer": "deterministic", "roles": ["process_mgr", "sales_mgr"], "preconditions": {}, "input": {"idempotency_key": "cx-legacy-1"}, "actions": [{"op": "load_fixture_state", "fixture": "quote/legacy_quote_case.json"}, {"op": "handoff_send", "source_project_id": "tp_legacy", "source_task_id": "t_legacy", "source_result_version": "R1", "handoff_kind": "cost", "business_case_id": "bc_legacy0001", "target_quote_session_id": "qs_legacy", "actor": "carol", "target_role_code": "sales_mgr", "snapshot": {"cost": {"total": {"amount": "15.5000"}, "parts": 1}}}], "expected": {"http": {"status": 200, "code": "sent", "current_step": 4, "linked_by": "case", "target_quote_session_id": "qs_legacy", "business_case_id": "bc_legacy0001", "source_project_id": "tp_legacy", "source_task_id": "t_legacy"}, "state": {"quote.qs_legacy.current_step": 4, "quote.qs_legacy.business_case_id": "bc_legacy0001", "quote.qs_legacy.steps.2.stale": false, "quote.qs_legacy.steps.2.snapshot.cost.total.amount": "15.5000", "quote.qs_legacy.steps.3.status": "done", "tasks.t_legacy.status": "completed", "handoffs.tp_legacy|t_legacy|R1|cost|bc_legacy0001.source_project_id": "tp_legacy", "handoffs.tp_legacy|t_legacy|R1|cost|bc_legacy0001.source_task_id": "t_legacy", "handoffs.tp_legacy|t_legacy|R1|cost|bc_legacy0001.business_case_id": "bc_legacy0001"}, "records": {"handoffs_created": 1, "tasks_completed": 1, "tasks_total": 2, "cards": 1, "projects": 1}, "forbidden": ["step_rollback", "cross_project_leak"]}, "invariants": ["step_monotonic", "no_cross_project_leak"], "tags": ["normal", "legacy"], "source_specs": ["docs/specs/tech-handoff-atomic-idempotent-close.md", "docs/specs/tech-quote-business-case-linkage.md", "docs/specs/tech-project-identity-single-source.md"]},
    {"id": "cross.legacy.late_handoff_replay_idempotent", "version": "1.0", "title": "晚到回传重复提交幂等：第二次只回 already_sent，不重复完成任务与消息", "domain": "cross_agent", "priority": "P0", "layer": "deterministic", "roles": ["process_mgr", "sales_mgr"], "preconditions": {}, "input": {"idempotency_key": "cx-legacy-2"}, "actions": [{"op": "load_fixture_state", "fixture": "quote/legacy_quote_case.json"}, {"op": "handoff_send", "source_project_id": "tp_legacy", "source_task_id": "t_legacy", "source_result_version": "R1", "handoff_kind": "cost", "business_case_id": "bc_legacy0001", "target_quote_session_id": "qs_legacy", "actor": "carol", "target_role_code": "sales_mgr", "snapshot": {"cost": {"total": {"amount": "15.5000"}, "parts": 1}}}, {"op": "handoff_send", "source_project_id": "tp_legacy", "source_task_id": "t_legacy", "source_result_version": "R1", "handoff_kind": "cost", "business_case_id": "bc_legacy0001", "target_quote_session_id": "qs_legacy", "actor": "carol", "target_role_code": "sales_mgr", "snapshot": {"cost": {"total": {"amount": "15.5000"}, "parts": 1}}}], "expected": {"http": {"status": 200, "code": "already_sent", "already_sent": true, "reused": true, "target_quote_session_id": "qs_legacy", "source_task_id": "t_legacy", "business_case_id": "bc_legacy0001"}, "state": {"quote.qs_legacy.current_step": 4, "tasks.t_legacy.status": "completed", "handoffs.tp_legacy|t_legacy|R1|cost|bc_legacy0001.handoff_id": {"$present": true}}, "records": {"handoffs_created": 1, "handoff_replays": 1, "tasks_completed": 1, "tasks_total": 2, "handoff_rows": 1}, "forbidden": ["duplicate_side_effect", "step_rollback"]}, "invariants": ["no_duplicate_side_effect", "step_monotonic"], "tags": ["idempotent", "legacy"], "source_specs": ["docs/specs/tech-handoff-atomic-idempotent-close.md", "docs/specs/tech-quote-business-case-linkage.md", "docs/specs/tech-project-identity-single-source.md"]}
  ]
}
